{
  "schemaVersion": 1,
  "registryVersion": "m1-local-assets-v1",
  "publicReleaseGate": "blocked-rights-unknown",
  "cardImages": [
    {
      "assetId": "baz-001-front-0",
      "kind": "card-image-reference",
      "cardId": "baz-001",
      "face": "front",
      "position": 0,
      "sourceUrls": {
        "thumbnail": "https://response-league.ru/api/v1/card-images/1fd1ff4c-e9a2-4542-8c7b-d4e640ef0c4e",
        "medium": "https://response-league.ru/api/v1/card-images/18839a86-836c-41ff-804d-cb085577fd50"
      },
      "rightsStatus": "unknown",
      "bundled": false,
      "usePolicy": "reference-only-not-for-public-build"
    },
    {
      "assetId": "baz-002-front-0",
      "kind": "card-image-reference",
      "cardId": "baz-002",
      "face": "front",
      "position": 0,
      "sourceUrls": {
        "thumbnail": "https://response-league.ru/api/v1/card-images/6ffb35dc-52f4-4e06-b880-5b2fe7e302f5",
        "medium": "https://response-league.ru/api/v1/card-images/8fb9d663-1217-4f21-9ee8-5588df1a7f4d"
      },
      "rightsStatus": "unknown",
      "bundled": false,
      "usePolicy": "reference-only-not-for-public-build"
    },
    {
      "assetId": "baz-003-front-0",
      "kind": "card-image-reference",
      "cardId": "baz-003",
      "face": "front",
      "position": 0,
      "sourceUrls": {
        "thumbnail": "https://response-league.ru/api/v1/card-images/dc88b5bb-8bbd-42b3-9751-85a3eb95ae94",
        "medium": "https://response-league.ru/api/v1/card-images/44d883d8-520e-4ccc-8a3b-8687605cbe14"
      },
      "rightsStatus": "unknown",
      "bundled": false,
      "usePolicy": "reference-only-not-for-public-build"
    },
    {
      "assetId": "baz-004-front-0",
      "kind": "card-image-reference",
      "cardId": "baz-004",
      "face": "front",
      "position": 0,
      "sourceUrls": {
        "thumbnail": "https://response-league.ru/api/v1/card-images/46a074b5-4530-4482-860a-80f04dde878d",
        "medium": "https://response-league.ru/api/v1/card-images/b5f1f415-4e69-4f4e-a794-5a3df857b367"
      },
      "rightsStatus": "unknown",
      "bundled": false,
      "usePolicy": "reference-only-not-for-public-build"
    },
    {
      "assetId": "baz-005-front-0",
      "kind": "card-image-reference",
      "cardId": "baz-005",
      "face": "front",
      "position": 0,
      "sourceUrls": {
        "thumbnail": "https://response-league.ru/api/v1/card-images/81d6c1b5-8331-4a78-a6b6-b9828b8c9b8d",
        "medium": "https://response-league.ru/api/v1/card-images/11eefdeb-850b-44a1-ad63-e988317574ad"
      },
      "rightsStatus": "unknown",
      "bundled": false,
      "usePolicy": "reference-only-not-for-public-build"
    },
    {
      "assetId": "baz-006-front-0",
      "kind": "card-image-reference",
      "cardId": "baz-006",
      "face": "front",
      "position": 0,
      "sourceUrls": {
        "thumbnail": "https://response-league.ru/api/v1/card-images/80d1f346-6d57-4802-abe6-0d0be3c9bc7b",
        "medium": "https://response-league.ru/api/v1/card-images/9888dd48-5b7f-4b1a-b105-2a7a8991c27c"
      },
      "rightsStatus": "unknown",
      "bundled": false,
      "usePolicy": "reference-only-not-for-public-build"
    },
    {
      "assetId": "baz-007-front-0",
      "kind": "card-image-reference",
      "cardId": "baz-007",
      "face": "front",
      "position": 0,
      "sourceUrls": {
        "thumbnail": "https://response-league.ru/api/v1/card-images/98fa1543-d6e3-45f0-9563-84bdc0341576",
        "medium": "https://response-league.ru/api/v1/card-images/4d2ad564-f0cb-4f1d-8b8f-9256d75f01b6"
      },
      "rightsStatus": "unknown",
      "bundled": false,
      "usePolicy": "reference-only-not-for-public-build"
    },
    {
      "assetId": "baz-008-front-0",
      "kind": "card-image-reference",
      "cardId": "baz-008",
      "face": "front",
      "position": 0,
      "sourceUrls": {
        "thumbnail": "https://response-league.ru/api/v1/card-images/19812444-f5ac-4545-b8ad-d338bad14050",
        "medium": "https://response-league.ru/api/v1/card-images/36607fda-31a4-42d1-b26c-98536195eb83"
      },
      "rightsStatus": "unknown",
      "bundled": false,
      "usePolicy": "reference-only-not-for-public-build"
    },
    {
      "assetId": "baz-009-front-0",
      "kind": "card-image-reference",
      "cardId": "baz-009",
      "face": "front",
      "position": 0,
      "sourceUrls": {
        "thumbnail": "https://response-league.ru/api/v1/card-images/b6b4b577-67dd-496e-ac8b-285ad8a9d9e5",
        "medium": "https://response-league.ru/api/v1/card-images/4be3adc8-1fc4-41b6-9f90-e6994706a669"
      },
      "rightsStatus": "unknown",
      "bundled": false,
      "usePolicy": "reference-only-not-for-public-build"
    },
    {
      "assetId": "baz-010-front-0",
      "kind": "card-image-reference",
      "cardId": "baz-010",
      "face": "front",
      "position": 0,
      "sourceUrls": {
        "thumbnail": "https://response-league.ru/api/v1/card-images/31128964-c992-4401-b71c-c9684c5f5aaf",
        "medium": "https://response-league.ru/api/v1/card-images/a6e585f2-9e56-4cd6-8c97-bcac0753eda4"
      },
      "rightsStatus": "unknown",
      "bundled": false,
      "usePolicy": "reference-only-not-for-public-build"
    },
    {
      "assetId": "baz-011-front-0",
      "kind": "card-image-reference",
      "cardId": "baz-011",
      "face": "front",
      "position": 0,
      "sourceUrls": {
        "thumbnail": "https://response-league.ru/api/v1/card-images/da206cab-0ba7-4452-b28b-562059b4749b",
        "medium": "https://response-league.ru/api/v1/card-images/7b111b7c-e2a3-4d56-a761-57940468b194"
      },
      "rightsStatus": "unknown",
      "bundled": false,
      "usePolicy": "reference-only-not-for-public-build"
    },
    {
      "assetId": "baz-012-front-0",
      "kind": "card-image-reference",
      "cardId": "baz-012",
      "face": "front",
      "position": 0,
      "sourceUrls": {
        "thumbnail": "https://response-league.ru/api/v1/card-images/c445f988-9e50-497a-8ae2-39288e9b14ef",
        "medium": "https://response-league.ru/api/v1/card-images/f7b5d391-96dc-4674-8deb-8f774d32b86e"
      },
      "rightsStatus": "unknown",
      "bundled": false,
      "usePolicy": "reference-only-not-for-public-build"
    },
    {
      "assetId": "baz-013-front-0",
      "kind": "card-image-reference",
      "cardId": "baz-013",
      "face": "front",
      "position": 0,
      "sourceUrls": {
        "thumbnail": "https://response-league.ru/api/v1/card-images/d3746c14-efcd-4640-9911-bfe18ae655c4",
        "medium": "https://response-league.ru/api/v1/card-images/3b081be7-a72d-4844-9954-26531c63233e"
      },
      "rightsStatus": "unknown",
      "bundled": false,
      "usePolicy": "reference-only-not-for-public-build"
    },
    {
      "assetId": "baz-014-front-0",
      "kind": "card-image-reference",
      "cardId": "baz-014",
      "face": "front",
      "position": 0,
      "sourceUrls": {
        "thumbnail": "https://response-league.ru/api/v1/card-images/2bd9ffed-4f7b-4e94-840d-b7e018b0e293",
        "medium": "https://response-league.ru/api/v1/card-images/d5c14f46-216d-4c36-a491-2e34cbdfa31d"
      },
      "rightsStatus": "unknown",
      "bundled": false,
      "usePolicy": "reference-only-not-for-public-build"
    },
    {
      "assetId": "baz-015-front-0",
      "kind": "card-image-reference",
      "cardId": "baz-015",
      "face": "front",
      "position": 0,
      "sourceUrls": {
        "thumbnail": "https://response-league.ru/api/v1/card-images/cca326e7-a607-41af-b751-232867e84233",
        "medium": "https://response-league.ru/api/v1/card-images/fe9cc4b0-0fca-41a7-b553-b34e46cbc8ed"
      },
      "rightsStatus": "unknown",
      "bundled": false,
      "usePolicy": "reference-only-not-for-public-build"
    },
    {
      "assetId": "baz-016-front-0",
      "kind": "card-image-reference",
      "cardId": "baz-016",
      "face": "front",
      "position": 0,
      "sourceUrls": {
        "thumbnail": "https://response-league.ru/api/v1/card-images/32a07ecc-96f9-4e99-88c2-8a1ec59f9e5a",
        "medium": "https://response-league.ru/api/v1/card-images/179dcf29-7623-4aca-ab56-4ecf60f7ea5e"
      },
      "rightsStatus": "unknown",
      "bundled": false,
      "usePolicy": "reference-only-not-for-public-build"
    },
    {
      "assetId": "baz-017-front-0",
      "kind": "card-image-reference",
      "cardId": "baz-017",
      "face": "front",
      "position": 0,
      "sourceUrls": {
        "thumbnail": "https://response-league.ru/api/v1/card-images/1fc35446-440d-4b1b-817c-d2ee949fdd76",
        "medium": "https://response-league.ru/api/v1/card-images/7d558f3e-cbff-4670-836d-1bc6d0328e5c"
      },
      "rightsStatus": "unknown",
      "bundled": false,
      "usePolicy": "reference-only-not-for-public-build"
    },
    {
      "assetId": "baz-018-front-0",
      "kind": "card-image-reference",
      "cardId": "baz-018",
      "face": "front",
      "position": 0,
      "sourceUrls": {
        "thumbnail": "https://response-league.ru/api/v1/card-images/f632cf1c-d05b-45fb-a66d-25a8b584a8fa",
        "medium": "https://response-league.ru/api/v1/card-images/496e0336-c7c0-47a6-8ac2-404e3fef6903"
      },
      "rightsStatus": "unknown",
      "bundled": false,
      "usePolicy": "reference-only-not-for-public-build"
    },
    {
      "assetId": "baz-019-front-0",
      "kind": "card-image-reference",
      "cardId": "baz-019",
      "face": "front",
      "position": 0,
      "sourceUrls": {
        "thumbnail": "https://response-league.ru/api/v1/card-images/457049f1-37e0-4a18-8d67-cd67e622ae82",
        "medium": "https://response-league.ru/api/v1/card-images/25eda1cc-8edf-4f95-989f-d4b5a5ef7c2e"
      },
      "rightsStatus": "unknown",
      "bundled": false,
      "usePolicy": "reference-only-not-for-public-build"
    },
    {
      "assetId": "baz-020-front-0",
      "kind": "card-image-reference",
      "cardId": "baz-020",